{
  "$schema": "http://json-schema.org/draft-07/schema#",
  "$id": "https://clawrocket.dev/contracts/editorial-room/v0/point.schema.json",
  "title": "PointCompiledTruth",
  "description": "Layer-3 page: specific claim/argument within a topic. See EDITORIAL_ROOM_CONTRACT.md §3.3.",
  "type": "object",
  "additionalProperties": false,
  "definitions": {
    "PointEvidence": {
      "type": "object",
      "additionalProperties": false,
      "required": [
        "kind",
        "url",
        "ref_slug",
        "quote_text",
        "quote_source",
        "notes"
      ],
      "properties": {
        "kind": {
          "type": "string",
          "enum": ["source_url", "back_catalog_ref", "claim_ledger_ref", "quote"]
        },
        "url": {
          "anyOf": [{ "type": "null" }, { "type": "string", "minLength": 1 }],
          "description": "External citation URL when kind = source_url."
        },
        "ref_slug": {
          "anyOf": [{ "type": "null" }, { "type": "string", "minLength": 1 }],
          "description": "For back_catalog_ref / claim_ledger_ref."
        },
        "quote_text": {
          "anyOf": [{ "type": "null" }, { "type": "string", "minLength": 1 }],
          "description": "Inline quote text when kind = quote."
        },
        "quote_source": {
          "anyOf": [{ "type": "null" }, { "type": "string", "minLength": 1 }],
          "description": "Attribution for the quote."
        },
        "notes": {
          "anyOf": [{ "type": "null" }, { "type": "string", "minLength": 1 }]
        }
      }
    }
  },
  "required": [
    "schema_version",
    "parent_topic_slug",
    "claim",
    "rationale",
    "evidence",
    "status",
    "conviction",
    "derived_from_pcp",
    "pcp_provenance",
    "derived_from_panel",
    "panel_provenance",
    "optimization_round_id",
    "last_activity_at"
  ],
  "properties": {
    "schema_version": { "const": "0" },
    "parent_topic_slug": {
      "type": "string",
      "minLength": 1,
      "description": "Single parent initially; multi-parent deferred."
    },
    "claim": {
      "type": "string",
      "minLength": 1,
      "description": "One-line ('PMs become builders')."
    },
    "rationale": {
      "anyOf": [{ "type": "null" }, { "type": "string", "minLength": 1 }],
      "description": "Free text; why this claim is true/interesting."
    },
    "evidence": {
      "type": "array",
      "items": { "$ref": "#/definitions/PointEvidence" }
    },
    "status": {
      "type": "string",
      "enum": ["active", "parked", "merged", "rejected"]
    },
    "conviction": {
      "type": "string",
      "enum": ["low", "medium", "high"],
      "description": "User's own confidence."
    },
    "derived_from_pcp": { "type": "boolean" },
    "pcp_provenance": {
      "anyOf": [
        { "type": "null" },
        { "$ref": "https://clawrocket.dev/contracts/editorial-room/v0/pcp_provenance.schema.json" }
      ]
    },
    "derived_from_panel": { "type": "boolean" },
    "panel_provenance": {
      "anyOf": [
        { "type": "null" },
        { "$ref": "https://clawrocket.dev/contracts/editorial-room/v0/panel_provenance.schema.json" }
      ]
    },
    "optimization_round_id": {
      "anyOf": [{ "type": "null" }, { "type": "string", "minLength": 1 }]
    },
    "last_activity_at": {
      "anyOf": [{ "type": "null" }, { "type": "string", "format": "date-time" }]
    }
  }
}
