{
  "schema_version": "0",
  "parent_topic_slug": "topic/ai-impact-on-game-dev-how-embracers-writedown-changed-indie-publishing-terms",
  "claim": "Deal-term lockdown: 2022-rate MGs are now the ceiling, not the floor.",
  "rationale": "The accounting reclassification means publishers can't recapture upside without restructuring; that locks the new shape for 18+ months.",
  "evidence": [],
  "status": "active",
  "conviction": "high",
  "derived_from_pcp": false,
  "pcp_provenance": null,
  "derived_from_panel": false,
  "panel_provenance": null,
  "optimization_round_id": null,
  "last_activity_at": "2026-04-30T11:32:00.000Z"
}
