{
  "schema_version": "0",
  "parent_topic_slug": "topic/ai-impact-on-game-dev-how-embracers-writedown-changed-indie-publishing-terms",
  "claim": "MG-as-conditional-liability is the load-bearing accounting change.",
  "rationale": "Without the reclassification, the deal-shape lockdown wouldn't hold beyond one quarter.",
  "evidence": [
    {
      "kind": "source_url",
      "url": "https://www.sec.gov/Archives/edgar/data/example/embracer-q3-8k.htm",
      "ref_slug": null,
      "quote_text": null,
      "quote_source": null,
      "notes": "Embracer Q3 8-K, pp. 14-16: explicit MG reclassification language."
    },
    {
      "kind": "back_catalog_ref",
      "url": null,
      "ref_slug": "back_catalog/2025-08-publisher-power-shift",
      "quote_text": null,
      "quote_source": null,
      "notes": "Predicts the structural shift; this Point names the accounting mechanism."
    },
    {
      "kind": "claim_ledger_ref",
      "url": null,
      "ref_slug": "claims_ledger/embracer-mg-reclassified-q3-2025",
      "quote_text": null,
      "quote_source": null,
      "notes": null
    },
    {
      "kind": "quote",
      "url": null,
      "ref_slug": null,
      "quote_text": "Their Q3 filing rewrote the entire MG line. Nobody on our side missed it.",
      "quote_source": "Annapurna staffer, background, 2026-04-22",
      "notes": "Anecdotal corroboration; flagged for verification before draft."
    }
  ],
  "status": "active",
  "conviction": "medium",
  "derived_from_pcp": false,
  "pcp_provenance": null,
  "derived_from_panel": false,
  "panel_provenance": null,
  "optimization_round_id": null,
  "last_activity_at": "2026-04-30T11:38:00.000Z"
}
